{
  "$schema": "./sugya.schema.json",
  "format": "derech-tevunos/sugya",
  "version": 1,
  "id": "berachos-yaakov",
  "title": "The promise and the fear",
  "tractate": "Berachos",
  "folio": "4a",
  "discussedAt": "Derech Tevunos ch. 9, p. 184",
  "party": "party-individual",
  "collection": "ramchal",
  "about": [
    "Ramchal's own illustration of `רמיא` and of `ישוב`, Heb p183, Eng p184. Both labels are his. The two verses enter as `tradition`, so they hold authority before the sugya begins."
  ],
  "units": [
    {
      "id": "promise",
      "speaker": "Genesis 28:15",
      "he": "והנה אנכי עמך ושמרתיך בכל אשר־תלך",
      "en": "Behold I am with you and will protect you wherever you go.",
      "move": { "element": "statement", "subtype": "firsthand", "attested": true },
      "provenance": "tradition",
      "anatomy": [
        {
          "kind": "subject-action",
          "note": "The predicate is what one party does for another — protection — which is chapter 11's seventh distinction. It is a promise of action, so the settlement can later ask on what the action depends without touching the words."
        },
        { "kind": "categorical", "basis": "marked", "note": "`בכל אשר תלך`: protection everywhere, the whole class of places." }
      ],
      "spans": {
        "he": { "subject": "2", "predicate": "3-6" },
        "en": { "subject": "2", "predicate": "3-12" }
      }
    },
    {
      "id": "fear",
      "speaker": "Genesis 32:8",
      "he": "ויירא יעקב מאד",
      "en": "And Yaakov was very much afraid.",
      "move": { "element": "statement", "subtype": "firsthand", "attested": true },
      "provenance": "tradition",
      "anatomy": [
        {
          "kind": "attribute-in-attached",
          "note": "Fear is an accident inhering in Yaakov, the shape of Ramchal's own example `בהמה מסכנת – שיש בה מקרה הסכנה` (Heb p231). It says nothing about what he is, only about a condition he is in — which is why the settlement can leave both sentences standing."
        },
        { "kind": "particular" }
      ],
      "spans": {
        "he": {
          "subject": "2",
          "predicate": ["1", "3"]
        },
        "en": { "subject": "2", "predicate": "3-6" }
      }
    },
    {
      "id": "rami",
      "speaker": "R. Yaakov bar Idi",
      "he": "רבי יעקב בר אידי רמי, כתיב … וכתיב",
      "en": "He raised a contradiction: it is written thus, and it is also written thus.",
      "move": {
        "element": "difficulty",
        "subtype": "apparentContradiction",
        "target": "promise",
        "marker": "… רמי, כתיב … וכתיב",
        "attested": true
      },
      "provenance": "derivation",
      "anatomy": [
        { "kind": "diametrically-opposed", "note": "Protected everywhere against very much afraid: as posed, a head-on clash." }
      ]
    },
    {
      "id": "sin",
      "speaker": "R. Yaakov bar Idi",
      "he": "אמר, שמא יגרם החטא",
      "en": "He said: Yaakov thought that perhaps sin may have some bearing on the promise.",
      "move": { "element": "resolution", "subtype": "settlement", "target": "rami", "attested": true },
      "provenance": "derivation",
      "anatomy": [
        {
          "kind": "subject-cause",
          "note": "`שמא יגרם החטא` — perhaps sin will *cause* it to lapse. The settlement works by naming a cause that can intervene between the promise and its fulfilment, so the respect it distinguishes is chapter 11's tenth distinction."
        },
        {
          "kind": "differs-in-context",
          "note": "The promise holds in the respect of merit; the fear is about sin having intervened. Not the same respect, so no clash."
        },
        { "kind": "qualified-possible", "note": "`שמא`: said as possible, not as certain." }
      ],
      "spans": {
        "he": { "subject": "4", "predicate": "3" },
        "en": { "subject": "7", "predicate": "8-14" }
      },
      "note": "A `ישוב`: the one who offers it believes it is true, so it fully discharges the difficulty."
    }
  ]
}
